house_id;status;address;zip_code;neighborhood_name;year;price(€);size_m2;living_area_m2;num_of_rooms;num_of_bedrooms;num_of_bathrooms;energy_label;url;description;ownership;insulation;parking;exteriors;created_at;viewing
43426107;Available;Henegouwerlaan 69 A;3021;Middelland;1907;450000;138;138;4;4;3;B;https://www.funda.nl/en/koop/rotterdam/appartement-43426107-henegouwerlaan-69-a/;Dubbele benedenwoning op  unieke  stads locatie  van maar  liefst ca. 138 m².  De  ligging is perfect want  op nog geen 10  minuten lopen bevindt  zich  het centraal station  en het  stadscentrum.  Om  de hoek vindt u de West-Kruiskade met een diversiteit aan winkels, speciaalzaken, terrasjes en andere eetgelegenheden. Bovendien vindt u in de directe omgeving diverse supermarkten, basis-en middelbare scholen en sportfaciliteiten. Openbaar vervoer, de rijkswegen A13 en A20 en diverse parken zoals Vroesenpark, Museumpark en Heemraadspark liggen op een steenworp afstand.  Indeling:  Beletage: Entree/tochtportaal, gang met toilet en fonteintje. Doorzon woonkamer van 12 meter diep, totaal ca. 46 m² met open  keuken voorzien van inbouwapparatuur.  Souterrain: Overloop, toilet met fonteintje en bergkast voorzien van cv-ketel ('23). 1e badkamer voorzien van een inloopdouche, wastafel en aansluiting voor de wasmachine. Royale slaapkamer ca. 20 m² aan de achterzijde met openslaande deuren naar de achtertuin ca. 6.00 x 5.00. Slaapkamer aan de voorzijde van ca. 14 m² met toegang tot de 2e badkamer en is voorzien van een inloopdouche, dubbele wastafel en aansluiting voor de wasmachine. Slaapkamer van ca. 8 m²   Tuin: van ca. 6.00 x 5.00 (gelegen op het zuidwesten).  Algemeen: - Bouwjaar 1907 - Woonoppervlakte ca. 138 m² - Inhoud ca. 487 m³ - Verwarming en warm water middels cv-ketel Nefit 2023 - Dubbel glas met glas in loodramen aan de voorzijde voorzien van voorzet ramen - De Vereniging van Eigenaars is in oprichting en de bijdrage zal ca. € 100,- per maand gaan worden - Energielabel B - Gelegen op eigen grond - De woning wordt verkocht zonder vragenlijst en lijst van zaken - In de koopovereenkomst zal een funderings- en ouderdomsclausule worden opgenomen - Oplevering in overleg  Deze informatie is door ons met de nodige zorgvuldigheid samengesteld. Onzerzijds wordt echter geen enkele aansprakelijkheid aanvaard voor enige onvolledigheid, onjuistheid of anderszins, dan wel de gevolgen daarvan. Alle opgegeven maten oppervlakten zijn indicatief.  Alle verstrekte informatie moet beschouwd worden als een uitnodiging tot het doen van een bod of om in onderhandeling te treden. Er kunnen geen rechten worden ontleend aan deze woninginformatie.  Wij behartigen de belangen van de verkopende partij. Neem uw eigen NVM-aankoopmakelaar mee.;na;Double glazing and secondary glazing; Registration with  Kv K No Annual meeting No Periodic contribution No Reserve fund present No Maintenance plan No Building insurance No; Location In center and in residential district Garden Back garden Back garden30 m² (5,05 meter deep and 6 meter broad) Garden location Located at the southwest;2024-03-24 16:41:45.374879;FALSE
43426019;Beschikbaar;Beverwaardseweg 342;3077;Beverwaard;1986;300000;91;91;4;3;2;B            1,40;https://www.funda.nl/en/koop/rotterdam/huis-43426019-beverwaardseweg-342/;"OP ZOEK NAAR  EEN  BETAALBARE GEZINSWONING  MET ZONNIGE  ACHTERTUIN? Op een ideale  locatie  mogen wij nu de Beverwaardseweg 342 aanbieden  met  een vraagprijs van  € 300.000,- K.K..  Het betreft  een  tussenwoning  met  3 fijne slaapkamers, verdeeld over 3 woonlagen met een achtertuin op het zuiden. De woning is gelegen aan een doorgaande weg met achter de woning voldoende parkeergelegenheid. Creeër jij hier je eigen woonwensen?   De woning is gelegen aan de rand van Rotterdam-Beverwaard met vlakbij een skatepark, speeltuin, voetbalveld en heerlijke wandelpaden. Op fietsafstand is er een opstapplaats voor de watertaxi en is Winkelcentrum Keizerswaard te bereiken. Op korte afstand bevinden zich uitvalswegen met goede aansluiting op de A15/A16, openbaar vervoer met een tramhalte op loopafstand, winkels en de Jachthaven IJsselmonde. Wat wil je nog meer?  Maak jij hier jouw droomwoning van? Kom je mogelijkheden bekijken! Van harte welkom voor een bezichtiging!   Indeling:   Begane grond:  * Smalle strook voortuin voorzien van bestrating; toegang tot de woning.  * Woningentree; hal met meterkast; trapopgang naar de slaapverdieping.  * Toiletruimte voorzien van duoblok-toiletopstelling, fonteintje, gedeeltelijk betegeld en een kast met de opstelling van de C.V.-combiketel. * Open keukenruimte aan de voorzijde voorzien van tegelvloer, gedeeltelijk betegelde of behangwanden en een functionele keukenopstelling met een spoelbak en afzuigkap.  * Tuingerichte woonkamer voorzien van behangwanden, trapkast, open verbinding met de keukenruimte en deur naar de achtertuin.  * Achtertuin, gelegen op het zuiden, voorzien van bestrating, groenperkjes, stenen berging (ca. 6 m²) en achterom. Achtergevel is voorzien van een zonnescherm.   Eerste verdieping: * Overloop voorzien van tapijtvloer en toegang tot de verschillende vertrekken. * Slaapkamer I aan de voorzijde voorzien van tapijtvloer en behangwanden. * Badkamer, grotendeels betegeld en voorzien van inloopdouche, wastafel en tweede toilet. * Royale slaapkamer II aan de achterzijde voorzien van tapijtvloer en 2 dakramen.  Tweede verdieping: * Ruime open zolderkamer IV met een dakraam, knieschotten en de wasmachine-aansluiting.     Algemeen:   * De woning is gelegen op erfpachtgrond, waarvan de canon is afgekocht tot en met 31 maart 2036. * Energielabel B, geldig tot 22 november 2027. * De wijk Beverwaard valt NIET onder de opkoopbescherming. Kijk voor meer informatie op de website van de gemeente Rotterdam. * De woning is geheel voorzien van kunststof raamkozijnen met dubbele beglazing. * Centrale, heteluchtverwarming en warmwatervoorziening middels combiketel (Intergas, 2019). * Aan de foto-presentatie zijn een aantal artist impressions toegevoegd. Deze foto's geven een weergave van hoe het object er na een verbouwing uit kan komen te zien. * De notariële eigendomsoverdracht van deze woning dient plaats te vinden bij de daartoe aangewezen projectnotaris: NL Notariaat te Etten-Leur. * Aangezien het een verkoop uit de huur betreft worden er extra artikelen aan de koopovereenkomst toegevoegd. Een concept koopovereenkomst is bij ons op te vragen en wordt na aanvraag van een bezichtiging ook inzichtelijk gemaakt in Move.nl. * Voor een indicatie van de maatvoering verwijzen wij naar de plattegrond. * Gezien het bouwjaar van de woning wordt er in de koopovereenkomst een ouderdomsclausule opgenomen en een artikel dat verband houdt met het feit dat de woning een voormalige huurwoning betreft.   Gebruiksoppervlakten en inhoud:  * Wonen ca. 91 m² * Externe bergruimte ca. 6 m² * Inhoud ca. 337 m³ * Perceeloppervlakte 105 m²  Bouwjaar woning            : 1986 Oplevering                     : Kan spoedig";Eigendom belast met erfpacht (einddatum erfpacht:  31-03-2085);Dubbel glas; Soort parkeergelegenheid Openbaar parkeren; Ligging Aan drukke weg en in woonwijk Tuin Achtertuin en voortuin Achtertuin57 m² (11,45 meter diep en 5,02 meter breed) Ligging tuin Gelegen op het zuiden bereikbaar via achterom;2024-03-24 16:41:45.374879;FALSE
43425207;Available;Van Nideckstraat 30 A02;3039;Blijdorp;1933;389000;90;90;4;3;2;C;https://www.funda.nl/en/koop/rotterdam/appartement-43425207-van-nideckstraat-30-a02/;De leukste huizen  vind  je bij  Kettner Makelaars!   Wijk: Blijdorp Achter  fraaie  en typische 30ér jaren gevel  gelegen, uitstekend  onderhouden,  ruim en licht  bovenhuis  op de 2e  en halve  3e  etage. Maar liefst 3 ruime slaapkamers, zonnig terras op het westen én een balkon op het zuidoosten. Gelegen in een sfeervolle en  rustige straat om de hoek van het Vroesenpark , metrostation Blijdorp (Randstadrail) metro en op loop/fietsafstand van Centraal Station en het centrum. Woonoppervlakte ca. 90m2. Eigen grond.  Located behind a beautiful and typical 1930s facade, an excellently maintained, spacious and bright upper house on the 2nd and half 3rd floors. No fewer than 3 spacious bedrooms, a sunny west-facing terrace and a southeast-facing balcony. Located in an attractive and quiet street around the corner from the Vroesenpark, Blijdorp (Randstadrail) metro station and within walking/cycling distance of Central Station and the City center. Living area approx. 90m2. Own  ground.  Openbaar vervoer: Om de hoek van  Metrostation Blijdorp (Randstadrail), Centraal station op slechts 5 minuten fietsafstand, tram en bus op loopafstand. Voorzieningen: in directe nabijheid van winkels (centrum), musea en diverse gezellige cafeetjes en restaurantjes. Recreatie: Om de hoek van het Vroesenpark, diergaarde Blijdorp en allerlei sportvoorzieningen in de directe omgeving.  Indeling: Begane grond: Entree met gedeelde trapopgang naar de 2e etage.  2e etage: Entree, ruime hal met garderobe, meterkast en modern geheel betegeld toilet.  Royale lichte living ca. 6.75 x 4.50/3.20 met fraaie laminaatvloeren, grote raampartijen over de volle breedte met glas-in-lood detaillering, originele sierlijsten plafonds en twee ruime vaste kasten.  Moderne keuken ca. 2.95 x  2.60 met de volgende inbouwapparatuur: 4-pits gaskookplaat, RvS afzuigschouw, oven, magnetron, vaatwasser, koelkast en vrieskast. De keuken heeft een eetbar en beschikt aan weerzijden over veel kast-en-werkruimte Deur naar zonnig balkon op het zuidoosten.  Ruime slaapkamer I ca. 4.00 x  3.85 met 2 vaste bergkasten. Ensuite moderne geheel betegelde badkamer ca. 2.30 x 1.85  met ligbad, wastafelmeubel en opstelplaats voor wasmachine en droger.   Halve 3e etage: Lichte overloop met dakkoepel, vaste bergkast en stookruimte. Ruime slaapkamer II ca. 3.85 x 3.75 met grote maatwerk schuifkastenwand over de volle breedte en deur naar terras.  Slaapkamer III ca. 2.80  x 1.65 met deur naar terras.  Ruim en zonnig terras op het noordwesten (late middag en avond zon).  Bijzonderheden: In sfeervolle straat in het gewilde Blijdorp en aan achter zeer fraaie en karakteristieke gevel gelegen  typisch 30’er jaren bovenhuis op de 2e en halve 3e etage.  Uitstekend onderhouden en voorzien van 3 (ruime) slaapkamers, zonnig balkon en ruim terras.  Om de hoek van Metrostation Blijdorp, winkels en het Vroesenpark. Snelle ontsluiting naar uitvalswegen en op loop/fietsafstand van het centrum en Centraal station.  Verwarming en warm water middels c.v.-combiketel (2022). Elektrische installatie is vernieuwd. Goed geïsoleerd en nagenoeg geheel voorzien van dubbele beglazing. Energielabel C.  Actieve vereniging van eigenaars met reservefonds, meerjaren onderhoudsplan en opstalverzekering. De bijdrage is thans ca. €177,-  per maand. Dak vernieuwd in 2018.  Onderdeel van het beschermd stadsgezicht Blijdorp/Bergpolder.  Parkeren is openbaar en via een vergunning, kosten vergunning ca. € 11,- per maand.  Woonoppervlakte ca. 90 m2. Inhoud ca. 301 m3. Bouwjaar ca. 1933. Eigen grond.   Deze informatie is met zorg samengesteld, maar voor de juistheid ervan kan door Kettner Makelaars o.g. B.V. geen aansprakelijkheid worden aanvaard, noch kan aan de vermelde gegevens enig recht worden ontleend. Nadrukkelijk is vermeld dat deze informatieverstrekking niet als een aanbieding of offerte mag worden beschouwd.;na;Double glazing and floor insulation; Type of parking facilities Paid parking, public parking and resident's parking permits; Location Alongside park, alongside a quiet road, in center and in residential district Balcony/roof garden Roof terrace present and balcony present;2024-03-24 16:41:45.374879;FALSE
43425981;Available;Admiraal de Ruyterweg 46 BC;3031;Rubroek;1956;500000;128;128;5;4;4;C;https://www.funda.nl/en/koop/rotterdam/appartement-43425981-admiraal-de-ruyterweg-46-bc/;MODERN 5/6-KAMER APPARTEMENT  IN  HARTJE ROTTERDAM  MET GROOT  TERRAS, TWEE BALKONS EN  TWEE  BADKAMERS!  IDEALE LIGGING:  HARTJE ROTTERDAM Dit royale  appartement, gelegen in  het  hart van Rotterdam,  biedt een  unieke  combinatie  van comfort en gemak. Genesteld in de levendige omgeving van de Jonker Fransstraat en De Meent, hebben bewoners alle geneugten van het stadsleven binnen handbereik. Met nabijheid van snelwegen A13/A16/A20 en diverse openbaar vervoersopties is dit appartement uitstekend bereikbaar vanuit Den Haag, Dordrecht, Utrecht en andere steden.  RUIMTELIJK: 128 M2 BINNEN- EN 40 M2 BUITENRUIMTE! Dit appartement, ontstaan door het samenvoegen van twee eenheden, biedt eigentijds comfort met hoogwaardige kunststof kozijnen en dubbele beglazing. Overvloedig natuurlijk licht stroomt door de ruime woonkamer die naadloos overgaat in een en-suite eetkamer en leidt naar een groot terras van 35 m2 op het zuidoosten. Daarnaast bieden twee extra balkons en twee bergingen in de onderbouw extra functionaliteit en opslagruimte.  VOLLEDIG UITGERUST VOOR MODERN LEVEN Met een moderne keuken, compleet met inbouwapparatuur, geniet dit appartement van alle nodige voorzieningen. Het beschikt over twee ruime slaapkamers, elk met een 'en suite' doucheruimte, waarbij de master slaapkamer ook een eigen toilet heeft, wat een luxe kenmerk is. De keuken grenst aan het dakterras, ideaal voor ontbijt, lunch of diner met een vleugje vakantiegevoel dankzij de mediterrane tegels en het groen. Het dakterras zelf is een groene oase met bloeiende klimopplanten die voor privacy zorgen en een picknicktafel voor ontspanning midden in de stad. Een 'drip'-systeem maakt het bewateren van de planten eenvoudig. Bovendien is er een op maat gemaakte radiatoromkasting in de woonkamer, wat een uniek detail toevoegt aan de ruimte.  EXTRA'S DIE HET VERSCHIL MAKEN De plafonds zijn in 2022 geïsoleerd, en de trap is in 2021 vernieuwd, waardoor recente verbeteringen benadrukt worden. Voor tweeverdieners bieden de twee kantoortjes extra ruimte voor thuiswerken, terwijl gezinnen kunnen profiteren van de mogelijkheid om een van de grote slaapkamers in te richten als kinderkamer met eigen douche.  Dit luxe appartement belichaamt het beste van beide werelden: het biedt niet alleen een uitgelezen kans om te genieten van het dynamische stadsleven, maar ook een oase van comfort en moderniteit te midden van de bruisende stad. Met zijn ideale ligging, ruime ontwerp en moderne voorzieningen is dit appartement een unieke kans voor wie op zoek is naar een exclusieve woonsituatie in het hart van Rotterdam.  KENMERKEN: - Eigen grond - Energielabel C - Bouwjaar ca. 1956 - Woonoppervlakte ca. 128 m2 - Riant terras 40 m2 op het Zuidwesten en 2 balkons op de bovenverdieping - Alle badkamers + WC's zijn in 2019 volledig gerenoveerd - Geweldige ligging in het centrum van Rotterdam - Verwarming middels cv combiketel (2019) - Bijdrage VvE EUR 253,-- per maand - Ouderdomsclausule van toepassing - Oplevering in overleg  INTERESSE? MAAK DAN SNEL EEN AFSPRAAK!  Ons advies is om bij het kopen van uw nieuwe woning uw eigen NVM makelaar mee te nemen.   TOELICHTINGSCLAUSULE NEN2580  De Meetinstructie is gebaseerd op de NEN2580. De Meetinstructie is bedoeld om een meer eenduidige manier van meten toe te passen voor het geven van een indicatie van de gebruiksoppervlakte. De Meetinstructie sluit verschillen in meetuitkomsten niet volledig uit, door bijvoorbeeld interpretatieverschillen, afrondingen of beperkingen bij het uitvoeren van de meting.  KOOPOVEREENKOMST PAS RECHTSGELDIG NA ONDERTEKENING  Een mondelinge overeenstemming tussen de particuliere verkoper en de particuliere koper is niet rechtsgeldig. Met andere woorden: er is geen koop. Er is pas sprake van een rechtsgeldige koop als de particuliere verkoper en de particuliere koper de koopovereenkomst hebben ondertekend. Dit vloeit voort uit artikel 7:2 Burgerlijk Wetboek. Een bevestiging van de mondelinge overeenstemming per e-mail of een toegestuurd concept van de koopovereenkomst wordt overigens niet gezien als een 'ondertekende koopovereenkomst'  “Deze informatie is door ons met de nodige zorgvuldigheid samengesteld. Onzerzijds wordt echter geen enkele aansprakelijkheid aanvaard voor enige onvolledigheid, onjuistheid of anderszins, dan wel de gevolgen daarvan. Alle opgegeven maten en oppervlakten zijn indicatief.”;Full ownership;Double glazing; Type of parking facilities Paid parking and resident's parking permits; Location In center and in residential district Balcony/roof garden Roof terrace present and balcony present;2024-03-24 16:41:45.374879;FALSE
43425710;Available;Jan Willem Frisostraat 37 b;3051;Hillegersberg Zuid;1927;295000;82;82;3;2;2;E;https://www.funda.nl/en/koop/rotterdam/appartement-43425710-jan-willem-frisostraat-37-b/;Gelegen in een  ruim  opgezette straat  in het  gezellige en geliefde “Kleiwegkwartier”,  prettig  ingedeeld 3-kamer appartement gelegen op  de 1e  en  2e verdieping. Het  appartement  is v.v. een  ruime en  lichte  woon-/eetkamer van ca. 30m2, prima keuken en badkamer en 2 slaapkamers. Het appartement is gelegen op loopafstand van winkelstraat “de Kleiweg” met een diversiteit aan winkels en horecagelegenheden en ook de Bergse Plassen, de Rotte en het Melanchtonpark zijn te voet bereikbaar. Voor het bereiken van het centrum van Rotterdam is er middels de tram en Station Noord een uitstekende verbinding. Het appartement dient intern op een aantal punten te worden gemoderniseerd waardoor er nog voldoende ruimte is om e.e.a. naar eigen hand te zetten.  Begane grond: entree, hal met eigen trapopgang naar de 1e verdieping.  1e verdieping: overloop met garderobe, toilet en trapopgang naar de 2e verdieping. Gesloten keuken a/d achterzijde v.v. een L-vormige keukenopstelling met vaatwasser, kookplaat en afzuigschouw. Heerlijk ruime en lichte doorzonwoonkamer van ca. 30m2.  2e verdieping: overloop v.v. zowel een kast met de CV-opstelling als een aparte kast met de wasmachineaansluiting. Geheel betegelde badkamer a/d voorzijde v.v. een grote inloopdouche en wastafelmeubel. Ruime hoofdslaapkamer over de volle diepte van het appartement en aansluitend een 2e slaapkamer a/d achterzijde.  Opmerkingen: bouwjaar ca. 1927, 82m2 woonoppervlak, energielabel E, gelegen op eigen grond, er is geen roerende zakenlijst en vragenlijst aanwezig, in de koopovereenkomst zal een ‘as is where is’ clausule worden opgenomen alsmede een niet bewoners clausule en funderingsclausule, de VvE is in oprichting met een verwachte maandelijkse bijdrage van € 90,00, geheel v.v. kunststof kozijnen met dubbel glas, verwarming en warmwater middels CV-ketel (2023), het transport dient plaats te vinden via Kooijman Autar te Rotterdam.  Oplevering: in overleg (kan snel);na;Double glazing; Registration with  Kv K Yes Annual meeting Yes Periodic contribution Yes (€ 90.00 per month) Reserve fund present No Maintenance plan No Building insurance Yes; Location Alongside a quiet road and in residential district;2024-03-24 16:41:45.374879;FALSE
43425604;Available;Violenstraat 18 B;3051;Hillegersberg Zuid;1934;325000;67;67;3;2;2;C;https://www.funda.nl/en/koop/rotterdam/appartement-43425604-violenstraat-18-b/;INSTAPKLAAR 3-KAMER APPARTEMENT  OP  DE HOEK  MET VEEL  DAGLICHT, SFEERVOLLE ERKER IN  DE  WOONKAMER EN MODERNE KEUKEN  MET INBOUWAPPARATUUR (ENERGIELABEL C)!  DAT OOK NOG  EENS  OP EIGEN GROND  IN EEN  HET  GEWILDE  KLEIWEGKWARTIER IN HILLEGERSBERG!  Ben je op zoek naar het perfecte appartement op een geweldige locatie? Zoek niet verder! Dit hoekappartement aan de Violenstraat biedt alles wat je nodig hebt voor comfortabel wonen. Het appartement is in 2013 geheel verbouwd en in de loop der jaren goed onderhouden. Mede door de hoekligging heb je hier heel veel daglicht en kan je rustig comfortabel wonen op een centrale locatie.  VERKOPER AAN HET WOORD ''Vanaf het eerste binnenkomen heeft dit huis mij verrast. Het gevoel was zo goed en is altijd zo gebleven. Het is dan ook met pijn in mijn hart afscheid nemen van mijn geliefde plekje. De reden is een volgende levensfase en samenwonen in Brabant. Het hoge plafond in de keuken is mijn favoriete bijzonderheid. Verder alles op loopafstand, als je thuis komt van een drukke dag loop je binnen een paar minuten de supermarkt in. Ook te voet naar centrum Rotterdam is goed te doen. Het theetje en iets lekkers bij Sue is het uitje wat ik zeker ga missen! Ik gun de volgende bewo(on)st(er)(s) hetzelfde unieke gevoel en veel woonplezier''.   HOEKLIGGING EN TWEE SLAAPKAMERS Dit appartement heeft een unieke hoekligging, wat extra privacy en ruimte biedt en beschikt nog over de details van de jaren-30 bouw. Zo is er in de woonkamer een sfeervolle erker voor extra ruimte. Daarnaast komt er veel daglicht het appartement binnen en loop je vanuit de woonkamer zo door naar de open keuken met de nodige inbouwapparatuur. Heb je behoefte aan een thuiswerkruimte, logeer- of extra kastenkamer? Er zijn 2 slaapkamers aanwezig. Hierbij is de hoofdslaapkamer van ruim 15 m² zeer riant te noemen! Als kers op de taart heb je ook nog eens een eigen balkon en zijn alle kozijnen voorzien van dubbele beglazing!  De moderne badkamer is een oase van ontspanning, compleet met een ruime inloopdouche. Daglicht stroomt door de grote ramen en verlicht de hele ruimte, waardoor een heldere en uitnodigende sfeer ontstaat. De prachtige erker in de woonkamer voegt niet alleen karakter toe, maar biedt ook een gezellige plek om te zitten en te genieten van het uitzicht op de straat.  VOLLEDIG GERENOVEERD Dit appartement is in 2013 volledig gerenoveerd en turnkey opgeleverd aan de huidige bewoonster die er veel aandacht aan heeft besteed. Destijds zijn alle leidingen voor gas & water en de gehele elektrische bedrading vernieuwd. De vernieuwde elektriciteitsvoorzieningen zijn niet alleen gericht op veiligheid, maar ook op betrouwbaarheid. Nieuwe leidingen voor gas & water in combinatie met dakisolatie dragen bij aan de efficiëntie en energiezuinigheid van de woning. Dit betekent niet alleen lagere energiekosten, maar ook een heerlijk comfortabel binnenklimaat waar je elke dag van kunt genieten. Met deze uitgebreide renovatie is er een instapklaar appartement ontstaan. Het enige wat je nog hoeft te doen is je meubels verhuizen en je kunt direct genieten van het comfort en de luxe die dit appartement je kan bieden.  RUSTIGE STRAAT IN HET KLEIWEGKWARTIER Het Kleiwegkwartier in Hillegersberg is een aantrekkelijke wijk in Rotterdam. Hier vind je een diversiteit aan voorzieningen en een prachtige omgeving. De Kleiweg, de belangrijkste winkelstraat van de wijk, biedt een gevarieerd aanbod aan winkels, van boetiekjes tot supermarkten en speciaalzaken. Ook is er een ruime keuze aan gezellige cafés, restaurants en lunchrooms waar je kunt genieten van een hapje en een drankje.  Wat het Kleiwegkwartier extra aantrekkelijk maakt, is de goede bereikbaarheid met het openbaar vervoer. Tramlijnen 4 en 8 zorgen voor een snelle verbinding met het centrum van Rotterdam, waar je kunt genieten van de vele musea, winkels en uitgaansgelegenheden. Daarnaast zijn er diverse buslijnen die de wijk verbinden met andere delen van de stad en is station Noord op enkele minuten fietsafstand, waardoor je gemakkelijk de stad in- en uit kunt. Bijzonder aan deze locatie is de nabijheid van de Bergse Plassen. Deze prachtige waterpartijen vormen een oase van rust midden in de stad. Hier kun je heerlijk wandelen langs de oevers, genieten van het uitzicht, of zelfs een bootje huren om het water op te gaan. Vooral op zonnige dagen is dit een populaire plek voor bewoners om te ontspannen en te recreëren.  Kortom, het Kleiwegkwartier in Hillegersberg biedt alles voor een aangename en comfortabele leefomgeving. Met zijn diverse voorzieningen, goede bereikbaarheid met het openbaar vervoer en de prachtige omgeving van de Bergse Plassen, is het een plek waar het heerlijk wonen en verblijven is.  KENMERKEN - Eigen grond - bouwjaar 1934 - Volledig gerenoveerd in 2013 - Gas- en waterleidingen vernieuwd - Elektrische bedrading vernieuwd - Sfeervolle erker in de woonkamer - Hoekligging met veel daglicht - Volledig voorzien van dubbele beglazing  - Actieve VvE met een maandelijkse bijdrage van ca. € 70,- per maand - Energielabel C - Oplevering in overleg.  INTERESSE? MAAK DAN SNEL EEN AFSPRAAK!  Ons advies is om bij het kopen van uw nieuwe woning uw eigen NVM makelaar mee te nemen.   TOELICHTINGSCLAUSULE NEN2580  De Meetinstructie is gebaseerd op de NEN2580. De Meetinstructie is bedoeld om een meer eenduidige manier van meten toe te passen voor het geven van een indicatie van de gebruiksoppervlakte. De Meetinstructie sluit verschillen in meetuitkomsten niet volledig uit, door bijvoorbeeld interpretatieverschillen, afrondingen of beperkingen bij het uitvoeren van de meting.  KOOPOVEREENKOMST PAS RECHTSGELDIG NA ONDERTEKENING  Een mondelinge overeenstemming tussen de particuliere verkoper en de particuliere koper is niet rechtsgeldig. Met andere woorden: er is geen koop. Er is pas sprake van een rechtsgeldige koop als de particuliere verkoper en de particuliere koper de koopovereenkomst hebben ondertekend. Dit vloeit voort uit artikel 7:2 Burgerlijk Wetboek. Een bevestiging van de mondelinge overeenstemming per e-mail of een toegestuurd concept van de koopovereenkomst wordt overigens niet gezien als een 'ondertekende koopovereenkomst'  “Deze informatie is door ons met de nodige zorgvuldigheid samengesteld. Onzerzijds wordt echter geen enkele aansprakelijkheid aanvaard voor enige onvolledigheid, onjuistheid of anderszins, dan wel de gevolgen daarvan. Alle opgegeven maten en oppervlakten zijn indicatief.”;na;Roof insulation, double glazing and insulated walls; Registration with  Kv K Yes Annual meeting Yes Periodic contribution Yes (€ 70.00 per month) Reserve fund present Yes Maintenance plan No Building insurance Yes; Location In residential district and freestanding location Balcony/roof garden Balcony present;2024-03-24 16:41:45.374879;FALSE
